,title,originallink,link,description,pubDate
94,아이유·임영웅·유재석 다 꺾었다…'8월 광고모델 브랜드평판' 1위는?,https://www.wikitree.co.kr/articles/780490,https://www.wikitree.co.kr/articles/780490,"한편 &apos;8월 광고모델 브랜드평판&apos; 상위 30위는 방탄소년단, 아이유, 임영웅, 유재석, 손흥민, 공유, 손석구, 블랙핑크, <b>김연아</b>, 김종국, 이찬원, 강다니엘, 차은우, 세븐틴, 이정재, 소녀시대, 정우성, 아이브, 에스파... ","Mon, 15 Aug 2022 11:16:00 +0900"
95,"광고모델 브랜드평판 8월 분석결과 1위 방탄소년단, 2위 아이유, 3위 임영웅",http://www.gpkorea.com/news/articleView.html?idxno=91276,http://www.gpkorea.com/news/articleView.html?idxno=91276,"블랙핑크, <b>김연아</b>, 김종국, 이찬원, 강다니엘, 차은우, 세븐틴, 이정재, 소녀시대, 정우성, 아이브... 블랙핑크, <b>김연아</b>, 김종국, 이찬원, 강다니엘, 차은우, 세븐틴, 이정재, 소녀시대, 정우성, 아이브, 에스파... ","Mon, 15 Aug 2022 10:22:00 +0900"
96,"SF9·펜타곤·포레스텔라, '2022 K글로벌 하트 드림 어워즈' 합류한다",http://www.stoo.com/article.php?aid=81990716271,http://www.stoo.com/article.php?aid=81990716271,특히 멤버 고우림이 오는 10월 &apos;피겨퀸&apos; <b>김연아</b>와 3년 여의 열애 끝에 웨딩마치를 울린다는 사실이 알려져 화제를 모은 그룹이다. 이번 &apos;2022 K글로벌 하트 드림 어워즈&apos;는 K팝을 세계적 반열에 올리며 한국 문화의... ,"Mon, 15 Aug 2022 10:12:00 +0900"
97,"고우림, ♥김연아 사로잡은 '훈훈 연하남' 매력",http://www.mydaily.co.kr/new_yk/html/read.php?newsid=202208150932568405&ext=na&utm_campaign=naver_news&utm_source=naver&utm_medium=related_news,https://n.news.naver.com/mnews/article/117/0003635913?sid=106,&apos;피겨여왕&apos; <b>김연아</b>와 결혼을 앞둔 크로스오버 그룹 포레스텔라의 고우림이 훈훈한 외모를 자랑했다.... 한편 고우림은 <b>김연아</b>와 2018년 올댓스케이트 아이스쇼 축하무대를 계기로 처음 만나 3년 간의 교제 끝에 결혼에... ,"Mon, 15 Aug 2022 10:12:00 +0900"
98,"SF9·펜타곤·포레스텔라, '2022 K글로벌 하트 드림 어워즈' 합류",http://www.tvdaily.co.kr/read.php3?aid=16605222081649754010,http://www.tvdaily.co.kr/read.php3?aid=16605222081649754010,특히 멤버 고우림이 오는 10월 &apos;피겨퀸&apos; <b>김연아</b>와 3년 여의 열애 끝에 웨딩마치를 울린다는 사실이 알려져 화제를 모은 그룹이다. 이번 &apos;2022 K글로벌 하트 드림 어워즈&apos;는 K팝을 세계적 반열에 올리며 한국 문화의... ,"Mon, 15 Aug 2022 09:56:00 +0900"
99,"방탄소년단, 8월 광고모델 브랜드평판 1위…아이유·임영웅 순",http://www.celuvmedia.com/article.php?aid=1660522500432708007,http://www.celuvmedia.com/article.php?aid=1660522500432708007,"2022년 8월 광고모델 브랜드평판 30위 순위는 방탄소년단, 아이유, 임영웅, 유재석, 손흥민, 공유, 손석구, 블랙핑크, <b>김연아</b>, 김종국, 이찬원, 강다니엘, 차은우, 세븐틴, 이정재, 소녀시대, 정우성, 아이브... ","Mon, 15 Aug 2022 09:18:00 +0900"
